{
  "$schema": "https://json-schema.org/draft/2020-12/schema",
  "$id": "https://portfolio-harness.local/schemas/verification.schema.json",
  "type": "object",
  "required": [
    "schemaVersion",
    "taskId",
    "status",
    "summary",
    "checks",
    "preview",
    "rollback",
    "headSha"
  ],
  "properties": {
    "schemaVersion": {
      "const": "1.0.0"
    },
    "taskId": {
      "type": "string",
      "pattern": "^[A-Z][A-Z0-9]*-[0-9]{3,}(?:-[a-z0-9][a-z0-9-]*)?$",
      "$comment": "taskId.pattern is generated from harness/contracts/task-id.json; run npm run harness:generate"
    },
    "status": {
      "type": "string",
      "enum": [
        "passed",
        "failed"
      ]
    },
    "summary": {
      "type": "string",
      "minLength": 1
    },
    "checks": {
      "type": "array",
      "minItems": 1,
      "items": {
        "type": "object",
        "required": [
          "name",
          "status",
          "evidence"
        ],
        "properties": {
          "name": {
            "type": "string",
            "minLength": 1
          },
          "status": {
            "type": "string",
            "enum": [
              "passed",
              "failed",
              "skipped"
            ]
          },
          "evidence": {
            "type": "string",
            "minLength": 1
          }
        },
        "additionalProperties": false
      }
    },
    "preview": {
      "type": "object",
      "required": [
        "status",
        "reason"
      ],
      "properties": {
        "status": {
          "type": "string",
          "enum": [
            "passed",
            "skipped"
          ]
        },
        "reason": {
          "type": [
            "string",
            "null"
          ]
        }
      },
      "additionalProperties": false
    },
    "rollback": {
      "type": "object",
      "required": [
        "confirmed",
        "evidence"
      ],
      "properties": {
        "confirmed": {
          "type": "boolean"
        },
        "evidence": {
          "type": "string",
          "minLength": 1
        }
      },
      "additionalProperties": false
    },
    "headSha": {
      "type": "string",
      "pattern": "^[0-9a-f]{40}$"
    }
  },
  "additionalProperties": false
}
